{
  "$schema": "https://json-schema.org/draft/2020-12/schema",
  "$id": "https://raw.githubusercontent.com/bilalobe/trackone/main/toolset/unified/schemas/verify_manifest_v2.schema.json",
  "title": "Verifiable Telemetry Segment Verification Manifest v2",
  "type": "object",
  "properties": {
    "version":{"const":2}, "ledger_id":{"type":"string","pattern":"^[0-9a-f]{32}$"}, "site_id":{"type":"string","minLength":1},
    "segment_number":{"type":"string","pattern":"^(0|[1-9][0-9]*)$"}, "commitment_profile_id":{"const":"verifiable-telemetry-canonical-cbor-v2"},
    "disclosure_class":{"enum":["A","B","C"]}, "artifacts":{"$ref":"#/$defs/artifacts"}, "anchoring":{"type":"object"},
    "operational_summary":{"type":"object"}, "extensions":{"type":"object"}
  }, "required":["version","ledger_id","site_id","segment_number","commitment_profile_id","disclosure_class","artifacts","anchoring"], "additionalProperties":false,
  "$defs":{"artifact_ref":{"type":"object","properties":{"path":{"type":"string","minLength":1},"sha256":{"type":"string","pattern":"^[0-9a-f]{64}$"}},"required":["path","sha256"],"additionalProperties":false},"artifacts":{"type":"object","properties":{"segment_cbor":{"$ref":"#/$defs/artifact_ref"},"predecessor_segment_cbor":{"$ref":"#/$defs/artifact_ref"},"records":{"type":"array","items":{"$ref":"#/$defs/artifact_ref"}},"batches":{"type":"array","items":{"$ref":"#/$defs/artifact_ref"}},"segment_ots":{"$ref":"#/$defs/artifact_ref"},"segment_ots_meta":{"$ref":"#/$defs/artifact_ref"},"peer_attest":{"$ref":"#/$defs/artifact_ref"},"tsa_tsr":{"$ref":"#/$defs/artifact_ref"}},"required":["segment_cbor"],"additionalProperties":false}}
}
